{
  "kind": "living-atlas-manifest",
  "schemaVersion": "0.1.0",
  "atlasVersion": "0.1.0",
  "atlasId": "aift-living-atlas",
  "title": "AIFT Living Atlas",
  "status": "canonical-draft",
  "description": "Evidence-backed present-tense map of public Federation entities and their explicit typed mappings to canonical Tree of Emergence node IDs.",
  "boundaries": {
    "canonicalMeaning": "The Tree of Emergence defines canonical lineage and meaning in manifests/tree.manifest.json.",
    "instantiatedReality": "The Living Atlas records public entities, documents, services, and repositories that currently instantiate or express Tree concepts.",
    "observedRuntime": "Runtime overlays may later report live observed state, but they must not redefine either Tree meaning or Atlas entity identity."
  },
  "entityTypes": {
    "people-community": {
      "label": "People / Community",
      "definition": "A person, group, community, or stewarded social body visible by consent."
    },
    "repository": {
      "label": "Repository",
      "definition": "A public or governed source repository with inspectable files, history, role, and evidence."
    },
    "project": {
      "label": "Project",
      "definition": "A bounded initiative, product lane, or workstream that may span repositories and documents."
    },
    "trust": {
      "label": "Trust",
      "definition": "A sovereign trust, trust seed, or governed stewardship body."
    },
    "publication": {
      "label": "Publication",
      "definition": "A paper, review packet, source summary, public PDF, or other authored knowledge artifact."
    },
    "agent": {
      "label": "Agent",
      "definition": "A bounded role, assistant, workflow actor, or repo-agent pattern with explicit authority limits."
    },
    "service": {
      "label": "Service",
      "definition": "A public or internal software surface that users can operate or inspect."
    },
    "infrastructure": {
      "label": "Infrastructure",
      "definition": "Hosting, routing, deployment, compute, naming, or provider-node substrate."
    },
    "governance": {
      "label": "Governance",
      "definition": "Decision, consent, authority, policy, or review structure."
    },
    "economic-system": {
      "label": "Economic System",
      "definition": "Value, wallet, currency, stewardship, market, or regenerative economy architecture."
    },
    "place": {
      "label": "Place",
      "definition": "A public, shared, or private location record governed by Atlas visibility and consent rules."
    },
    "research-package": {
      "label": "Research Package",
      "definition": "A reproducible or reviewable research bundle with scripts, data policy, outputs, and limitations."
    }
  },
  "mappingRelations": {
    "expresses": {
      "label": "Expresses",
      "definition": "The Atlas entity expresses a Tree concept as doctrine, design language, or public explanation."
    },
    "implements": {
      "label": "Implements",
      "definition": "The Atlas entity implements a Tree concept through code, schema, manifest, workflow, or service behavior."
    },
    "documents": {
      "label": "Documents",
      "definition": "The Atlas entity documents, researches, or explains a Tree concept without necessarily implementing it."
    },
    "presents": {
      "label": "Presents",
      "definition": "The Atlas entity presents a Tree concept to public users through an interface or publication surface."
    },
    "supports": {
      "label": "Supports",
      "definition": "The Atlas entity provides enabling infrastructure, tooling, or context for a Tree concept."
    },
    "governs": {
      "label": "Governs",
      "definition": "The Atlas entity supplies policy, consent, evidence, or authority boundaries for a Tree concept."
    },
    "researches": {
      "label": "Researches",
      "definition": "The Atlas entity investigates a Tree concept through bounded research or exploratory analysis."
    },
    "instantiates": {
      "label": "Instantiates",
      "definition": "The Atlas entity is a current public manifestation of a Tree concept without becoming its definition."
    }
  },
  "sourceRefs": [
    {
      "id": "genesis.readme",
      "label": "AIFT Genesis README",
      "uri": "README.md",
      "type": "repository-document"
    },
    {
      "id": "genesis.living-atlas",
      "label": "Genesis Living Atlas Doctrine",
      "uri": "civilization/LIVING_ATLAS.md",
      "type": "repository-document"
    },
    {
      "id": "genesis.tree",
      "label": "Genesis Tree Manifest",
      "uri": "manifests/tree.manifest.json",
      "type": "repository-document"
    },
    {
      "id": "portal.public-repo-inventory",
      "label": "Public Repository Inventory",
      "uri": "https://github.com/AIFreedomTrustFederation/www.aifreedomtrust.com/blob/main/docs/public-repo-inventory.md",
      "type": "portal-document"
    },
    {
      "id": "portal.status",
      "label": "Public Portal Status",
      "uri": "https://github.com/AIFreedomTrustFederation/www.aifreedomtrust.com/blob/main/docs/status.md",
      "type": "portal-document"
    },
    {
      "id": "portal.readme",
      "label": "Public Portal README",
      "uri": "https://github.com/AIFreedomTrustFederation/www.aifreedomtrust.com/blob/main/README.md",
      "type": "portal-document"
    },
    {
      "id": "forge.readme",
      "label": "AIFT Forge README",
      "uri": "https://github.com/AIFreedomTrustFederation/AIFT-Forge/blob/main/README.md",
      "type": "public-repository"
    },
    {
      "id": "ai-freedom-trust.readme",
      "label": "AI-Freedom-Trust README",
      "uri": "https://github.com/AIFreedomTrustFederation/AI-Freedom-Trust/blob/main/README.md",
      "type": "public-repository"
    },
    {
      "id": "ai-freedom-trust.status",
      "label": "AI-Freedom-Trust Status",
      "uri": "https://github.com/AIFreedomTrustFederation/AI-Freedom-Trust/blob/main/docs/status.md",
      "type": "repository-document"
    },
    {
      "id": "ai-freedom-trust.flight-paper",
      "label": "Aetherion Flight Paper",
      "uri": "https://github.com/AIFreedomTrustFederation/AI-Freedom-Trust/blob/main/docs/pdf/aetherion-flight-paper-post-quantum-sovereign-network.pdf",
      "type": "public-artifact"
    },
    {
      "id": "ai-freedom-trust.empirical-paper",
      "label": "AetherCore Empirical Paper",
      "uri": "https://github.com/AIFreedomTrustFederation/AI-Freedom-Trust/blob/main/docs/pdf/aethercore-empirical-trust-density-covid.pdf",
      "type": "public-artifact"
    },
    {
      "id": "aether-coin.repo",
      "label": "Aether Coin Biozonecurrency Repository",
      "uri": "https://github.com/AIFreedomTrustFederation/Aether_Coin_biozonecurrency",
      "type": "public-repository"
    },
    {
      "id": "vps.repo",
      "label": "VPS Repository",
      "uri": "https://github.com/AIFreedomTrustFederation/VPS",
      "type": "public-repository"
    },
    {
      "id": "capital-city-provisions.repo",
      "label": "Capital City Provisions Repository",
      "uri": "https://github.com/AIFreedomTrustFederation/capital-city-provisions",
      "type": "public-repository"
    }
  ],
  "entities": [
    {
      "id": "repo-aift-genesis",
      "type": "repository",
      "label": "AIFT-Genesis",
      "shortLabel": "Genesis",
      "description": "Canonical civilization genome repository for schemas, manifests, templates, Tree of Life, Living Atlas doctrine, and the Tree of Emergence graph.",
      "status": "active-foundation",
      "visibility": "public",
      "evidenceStatus": "public-repository",
      "sourceRefs": ["genesis.readme", "genesis.living-atlas", "genesis.tree"],
      "links": [
        {
          "label": "Repository",
          "uri": "https://github.com/AIFreedomTrustFederation/AIFT-Genesis",
          "type": "repository"
        }
      ],
      "tags": ["genesis", "schemas", "manifests", "tree", "atlas"],
      "metadata": {
        "claimBoundary": "Defines canonical contracts and doctrine; does not operate every downstream system."
      }
    },
    {
      "id": "repo-aift-forge",
      "type": "repository",
      "label": "AIFT-Forge",
      "shortLabel": "Forge",
      "description": "Federation core repository for reusable Explorer engine behavior, agentic infrastructure language, repository/build/package patterns, and shared operating doctrine.",
      "status": "active-foundation",
      "visibility": "public",
      "evidenceStatus": "public-repository",
      "sourceRefs": ["forge.readme", "portal.public-repo-inventory"],
      "links": [
        {
          "label": "Repository",
          "uri": "https://github.com/AIFreedomTrustFederation/AIFT-Forge",
          "type": "repository"
        }
      ],
      "tags": ["forge", "engine", "agents", "software", "infrastructure"],
      "metadata": {
        "claimBoundary": "Foundation and reusable engine work; no stable release or audited security status is claimed here."
      }
    },
    {
      "id": "repo-www-aifreedomtrust-com",
      "type": "repository",
      "label": "www.aifreedomtrust.com",
      "shortLabel": "Portal",
      "description": "Public static portal and mission-facing doorway for the AI Freedom Trust Federation.",
      "status": "active",
      "visibility": "public",
      "evidenceStatus": "public-pages",
      "sourceRefs": ["portal.readme", "portal.status", "portal.public-repo-inventory"],
      "links": [
        {
          "label": "Repository",
          "uri": "https://github.com/AIFreedomTrustFederation/www.aifreedomtrust.com",
          "type": "repository"
        },
        {
          "label": "Public Site",
          "uri": "https://aifreedomtrustfederation.github.io/www.aifreedomtrust.com/",
          "type": "site"
        }
      ],
      "tags": ["portal", "public", "documentation", "tree-explorer"],
      "metadata": {